{
  "decision_id": "adr-0001",
  "status": "ACCEPTED",
  "context": "Choose the request digest scheme for effect intents.",
  "options": ["RFC 8785 JCS", "raw SHA-256 of serialized JSON", "merkle over fields"],
  "decision": "RFC 8785 JCS canonical request digest",
  "rationale": "Canonicalization makes reordered requests share one identity.",
  "consequences": "Non-integer numbers must be carried as strings.",
  "supersedes_id": null,
  "owner": "effect-kernel",
  "recorded_at": "2026-08-31T12:00:00Z"
}
